{
	"schemaVersion": "1",
	"id": "pack:ar-morphology",
	"name": "Arabic Morphology Composite Textpack",
	"version": "0.1.0",
	"packageName": "@ismail-elkorchi/textpack-ar-morphology",
	"targets": {
		"languages": [
			"ar"
		],
		"scripts": [
			"Arab"
		],
		"modalities": [
			"typed"
		]
	},
	"engines": {
		"@ismail-elkorchi/textpack": "^0.1.0"
	},
	"resources": [],
	"components": [
		{
			"packageName": "@ismail-elkorchi/textpack-ar-msa-morphology",
			"versionRange": "0.1.0",
			"role": "required",
			"reason": "Arabic MSA CAMeL Morph morpheme, feature, default, and compatibility resources.",
			"licensePolicy": "allow-attribution",
			"capabilityPolicy": "contributes-default",
			"artifactPolicy": "none"
		}
	],
	"capabilitySlots": [
		{
			"slot": "morphology",
			"status": "task-supported",
			"notes": [
				"The required component graph provides CAMeL Morph MSA morpheme inventory, feature inventory, defaults, compatibility tables, and canonical morphology resources."
			]
		},
		{
			"slot": "quality",
			"status": "task-supported",
			"notes": [
				"Generated component reports and evaluation records are available for the required morphology component."
			]
		}
	],
	"license": "CC-BY-4.0",
	"citations": [
		"CAMeL Morph MSA LREC-COLING 2024 release."
	],
	"generated": {
		"forgeVersion": "0.1.0",
		"lockfileChecksum": "sha256:47e22f7d7e35324945ccf546ccb43d204cd6941b133a20a6988898b7e3280d64",
		"generatedAt": "2026-06-08T00:00:00.000Z",
		"generatorCommand": "node tools/textpack-forge/cli.mjs build"
	}
}
