{
	"schemaVersion": "1",
	"id": "pack:fr-lexicon-sa",
	"name": "French Lexicon Share-Alike Composite Textpack",
	"version": "0.1.0",
	"packageName": "@ismail-elkorchi/textpack-fr-lexicon-sa",
	"targets": {
		"languages": [
			"fr"
		],
		"scripts": [
			"Latn"
		],
		"modalities": [
			"typed"
		]
	},
	"engines": {
		"@ismail-elkorchi/textpack": "^0.1.0"
	},
	"resources": [],
	"components": [
		{
			"packageName": "@ismail-elkorchi/textpack-fr-lexique-sa",
			"versionRange": "0.1.0",
			"role": "required",
			"reason": "Share-alike isolated Lexique 3.83 lexical entries and canonical lexicon resources.",
			"licensePolicy": "allow-share-alike",
			"capabilityPolicy": "available-optional",
			"artifactPolicy": "none"
		}
	],
	"capabilitySlots": [
		{
			"slot": "lexicon",
			"status": "task-supported",
			"notes": [
				"The required component graph provides Lexique 3.83 lexical entries, lemmas, frequency fields, and canonical lexicon resources under the share-alike policy surface."
			]
		},
		{
			"slot": "quality",
			"status": "task-supported",
			"notes": [
				"Generated component reports and evaluation records are available for the required share-alike lexicon component."
			]
		}
	],
	"license": "CC-BY-SA-4.0",
	"citations": [
		"Lexique 3.83, 2019-06-04."
	],
	"generated": {
		"forgeVersion": "0.1.0",
		"lockfileChecksum": "sha256:bfb26766d581816c40cb7a51c8de8a8ee3b5d902bfec74d803466a791a1e72c8",
		"generatedAt": "2026-06-08T00:00:00.000Z",
		"generatorCommand": "node tools/textpack-forge/cli.mjs build"
	}
}
