{
	"schemaVersion": "1",
	"id": "pack:ar-lexicon",
	"name": "Arabic Lexicon Composite Textpack",
	"version": "0.1.0",
	"packageName": "@ismail-elkorchi/textpack-ar-lexicon",
	"targets": {
		"languages": [
			"ar"
		],
		"scripts": [
			"Arab"
		],
		"modalities": [
			"typed"
		]
	},
	"engines": {
		"@ismail-elkorchi/textpack": "^0.1.0"
	},
	"resources": [],
	"components": [
		{
			"packageName": "@ismail-elkorchi/textpack-wordnet-ar",
			"versionRange": "0.1.0",
			"role": "required",
			"reason": "Default Arabic lexical-semantic WordNet lexical entries and canonical lexicon resources.",
			"licensePolicy": "allow-attribution",
			"capabilityPolicy": "contributes-default",
			"artifactPolicy": "none"
		},
		{
			"packageName": "@ismail-elkorchi/textpack-ar-msa-morphology",
			"versionRange": "0.1.0",
			"role": "required",
			"reason": "Arabic MSA CAMeL Morph morpheme inventory and morphology lexicon resources.",
			"licensePolicy": "allow-attribution",
			"capabilityPolicy": "contributes-default",
			"artifactPolicy": "none"
		}
	],
	"capabilitySlots": [
		{
			"slot": "lexicon",
			"status": "task-supported",
			"notes": [
				"The required component graph provides Arabic WordNet lexical entries and CAMeL Morph MSA morpheme inventory resources."
			]
		},
		{
			"slot": "quality",
			"status": "task-supported",
			"notes": [
				"Generated component reports and evaluation records are available for every required lexical component."
			]
		}
	],
	"license": "CC-BY-4.0",
	"citations": [
		"Arabic WordNet 4.1.0.",
		"CAMeL Morph MSA LREC-COLING 2024 release."
	],
	"generated": {
		"forgeVersion": "0.1.0",
		"lockfileChecksum": "sha256:bfb26766d581816c40cb7a51c8de8a8ee3b5d902bfec74d803466a791a1e72c8",
		"generatedAt": "2026-06-08T00:00:00.000Z",
		"generatorCommand": "node tools/textpack-forge/cli.mjs build"
	}
}
